id,title,intro,text,date
6,Японские палочки Pocky,Праздник Pocky Day,"Национальный праздник Pocky Day впервые начал праздноваться в 1994 году в южнокорейском городе Пусан. Уже в 1997 году он стал широко известным. День Поки довольно быстро набрал популярность у молодёжи и стал азиатским аналогом Дня Святого Валентина. День приходится на 11 ноября и уже стал национальным праздником. В отличие от Дня святого Валентина, в этот день люди дарят палочки Поки не только в знак любви, но для того, чтобы показать уважение и симпатию для близкого им человека. ",2023-12-29 04:19:58
5,В чём секрет успеха шоколада Milka,В чём секрет успеха шоколада Milka,"Milka - бренд, который не только завоевал весь мир своим изысканным шоколадом, но и проник в самые глубины сердец любителей сладостей. В чем же заключается секрет успеха этого непревзойденного альпийского шедевра?



Каждый кусочек Milka - это истинное чудо для ваших вкусовых рецепторов. Сочетание нежного шоколада и аромата альпийского молока делает его вкус неповторимым. Но важный элемент, который делает Milka таким особенным, - это высокое качество ингредиентов. Каждый ингредиент, используемый в производстве Milka, проходит строгий отбор, чтобы обеспечить истинное наслаждение и удовольствие в каждой упаковке.



Бренд персонажа - фиолетовая корова",2023-12-27 07:09:11
4,Прекрасное веселье в каждой жвачке: Hubba Bubba - история вкуса и радости,Hubba Bubba - вкус и радость,"Сладкая жвачка Hubba Bubba - это не просто конфета для жевания, это настоящий символ веселья и незабываемых моментов. Среди множества сладостей этот великолепный продукт выделяется своим уникальным вкусом и внушительной историей. Однако не только вкус делает Hubba Bubba такой особенной. Давайте углубимся в детали и узнаем больше о неповторимых формах этой замечательной жвачки






Уникальность Hubba Bubba проявляется также в ее разнообразии форм. Одной из наиболее узнаваемых форм являются маленькие палочки, каждая из которых хранит в себе секретный вкус внутри. Это позволяет наслаждаться не только прекрасным ароматом, но и ощущением открытия новой сладкой тайны с каждой жевательной пластинкой.



Кроме того, Hubba Bubba славится своими огромными пузырями, которые можно создавать, раздувая жвачку. Эти великолепные шедевры пузырной магии поразят вас своей размерами и удивительной прочностью. Развлекайтесь, создавая целые пузырные волшебства с Hubba Bubba!



Взрыв вкуса и веселья с Hubba Bubba: история долгоживущей сладкой легенды






Созданная в 1979 году компанией Wm. Wrigley Jr. Company, жвачка Hubba Bubba сразу стала звездой среди молодежи и детей. Она поразила мир своей невероятной растяжимостью и неповторимыми вкусами. Первоначально представленная в Америке, Hubba Bubba вскоре завоевала сердца людей по всему миру.



Что делает Hubba Bubba настолько неповторимой? Это просто! Ее яркие и сочные ароматы, позволяющие окунуться в настоящий фестиваль вкусов, и удивительная способность растягиваться до невероятных размеров, что стало настоящей фишкой. Первоначально запускаясь с несколькими классическими вкусами, Hubba Bubba с течением времени разнообразила свой ассортимент, предлагая десятки оригинальных и экзотических вариантов.



 Вкус детства, который никогда не уходит




Долгие годы прошли, но Hubba Bubba остается популярной, как никогда. Эта жвачка привлекает не только детей, но и взрослых, которые ценят вкус ностальгии и ярких впечатлений. Взяв Hubba Bubba в руки, вы словно возвращаетесь в дни радостных игр и беззаботных моментов детства.



Счастье и радость, упакованные в каждую жвачку Hubba Bubba, остаются с нами на протяжении долгих лет. Станьте частью этой сладкой легенды, исследуйте ее богатый мир вкусов и вспомните яркие моменты вашей жизни. И помните, что вы всегда можете заказать свои любимые вкусы Hubba Bubba в нашем интернет-магазине. Добавьте кусочек радости и веселья в свою жизнь с Hubba Bubba прямо сейчас!
",2023-12-27 07:08:18
